{
  "figure_reference_count": 55,
  "manuscript_count": 8,
  "missing_interpretive_boundaries": [],
  "missing_or_weak_captions": [],
  "missing_source_artifacts": [],
  "missing_visual_encoding_language": [],
  "ok": true,
  "rows": [
    {
      "caption_length": 631,
      "figure_id": "qrf_sector_situation",
      "figure_path": "../../output/figures/qrf_sector_situation.png",
      "has_interpretive_boundary": true,
      "has_source_artifact": true,
      "has_visual_encoding_language": true,
      "manuscript": "01_introduction.md",
      "ok": true,
      "source_artifact_count": 2,
      "source_map_caption_length": 631,
      "visual_encoding": "Layered schematic; top boundary cells encode the shared channels and their observation symbols, dotted vertical lines encode the same evidenced bit reaching every lens, colored lens cells and text encode QRF sector labels, the right-hand text encodes the sector count per lens, and the legend maps each color to a sector label."
    },
    {
      "caption_length": 337,
      "figure_id": "qrf_boundary_screen_geometry",
      "figure_path": "../../output/figures/qrf_boundary_screen_geometry.png",
      "has_interpretive_boundary": true,
      "has_source_artifact": true,
      "has_visual_encoding_language": true,
      "manuscript": "01_introduction.md",
      "ok": true,
      "source_artifact_count": 3,
      "source_map_caption_length": 337,
      "visual_encoding": "Standalone schematic; dashed circle encodes the finite boundary screen, labeled nodes encode b0-b5 channels, orange and blue directed edges encode action and observation flow, role text labels encode channel semantics, and the legend explains boundary, channel, action, and observation marks."
    },
    {
      "caption_length": 692,
      "figure_id": "boundary_use_vs_ontology",
      "figure_path": "../../output/figures/boundary_use_vs_ontology.png",
      "has_interpretive_boundary": true,
      "has_source_artifact": true,
      "has_visual_encoding_language": true,
      "manuscript": "01_introduction.md",
      "ok": true,
      "source_artifact_count": 1,
      "source_map_caption_length": 692,
      "visual_encoding": "Stepwise schematic; a top source box and b0-b5 bit cells encode the shared finite boundary screen, arrows encode the two possible readings, numbered badges and large rounded boxes encode licensed use versus blocked ontology, teal and amber borders encode pass and blocked verdicts, italic audit strips encode the bound validator flags, and the legend maps each verdict color."
    },
    {
      "caption_length": 326,
      "figure_id": "qrf_channel_relabeling_ledger",
      "figure_path": "../../output/figures/qrf_channel_relabeling_ledger.png",
      "has_interpretive_boundary": true,
      "has_source_artifact": true,
      "has_visual_encoding_language": true,
      "manuscript": "03_results.md",
      "ok": true,
      "source_artifact_count": 2,
      "source_map_caption_length": 326,
      "visual_encoding": "Matrix-style ledger; columns are b0-b5 channels, rows are channel roles, invariant same-bit evidence, and three QRF profiles; sector colors plus cell text encode relabeling, the equation callout anchors equations 7-10, and the legend maps each color to a sector label."
    },
    {
      "caption_length": 376,
      "figure_id": "qrf_invariance_policy_flow",
      "figure_path": "../../output/figures/qrf_invariance_policy_flow.png",
      "has_interpretive_boundary": true,
      "has_source_artifact": true,
      "has_visual_encoding_language": true,
      "manuscript": "03_results.md",
      "ok": true,
      "source_artifact_count": 2,
      "source_map_caption_length": 376,
      "visual_encoding": "Two-panel chart; Panel A uses bars for admissible probability mass, a dashed line for the normalized target, and an x marker for the failing control, while Panel B uses horizontal stacked bars and an external legend to encode selected actions by profile."
    },
    {
      "caption_length": 260,
      "figure_id": "finite_quantum_scope_summary",
      "figure_path": "../../output/figures/finite_quantum_scope_summary.png",
      "has_interpretive_boundary": true,
      "has_source_artifact": true,
      "has_visual_encoding_language": true,
      "manuscript": "03_results.md",
      "ok": true,
      "source_artifact_count": 1,
      "source_map_caption_length": 260,
      "visual_encoding": "Matrix figure; row labels group quantum engine families, column labels distinguish finite implementation, negative controls, main-text claim scope, and blocked stronger claims, while fill color and the legend encode finite-validated cells versus hatched blocked-claim cells."
    },
    {
      "caption_length": 540,
      "figure_id": "separation_prior_emergence",
      "figure_path": "../../output/figures/separation_prior_emergence.png",
      "has_interpretive_boundary": true,
      "has_source_artifact": true,
      "has_visual_encoding_language": true,
      "manuscript": "03_results.md",
      "ok": true,
      "source_artifact_count": 1,
      "source_map_caption_length": 540,
      "visual_encoding": "Single-panel line chart whose lines encode factored versus unfactored prediction error and a dashed line encodes the measured factored advantage across the empowerment axis, with a legend and a zero reference line."
    },
    {
      "caption_length": 674,
      "figure_id": "separation_prior_net_value",
      "figure_path": "../../output/figures/separation_prior_net_value.png",
      "has_interpretive_boundary": true,
      "has_source_artifact": true,
      "has_visual_encoding_language": true,
      "manuscript": "03_results.md",
      "ok": true,
      "source_artifact_count": 2,
      "source_map_caption_length": 674,
      "visual_encoding": "Single-panel line chart; one line per prior precision encodes delta free energy versus metacognitive access on the axes, the bolded line marks the precision whose net value crosses zero, shaded keep and prune bands encode the sign of net value, a dashed vertical line marks the crossing access, and the legend names each precision line."
    },
    {
      "caption_length": 325,
      "figure_id": "bmr_free_energy_decomposition",
      "figure_path": "../../output/figures/bmr_free_energy_decomposition.png",
      "has_interpretive_boundary": true,
      "has_source_artifact": true,
      "has_visual_encoding_language": true,
      "manuscript": "03_results.md",
      "ok": true,
      "source_artifact_count": 1,
      "source_map_caption_length": 325,
      "visual_encoding": "Line chart; color and marker legend encodes Delta F, Delta complexity, and Delta accuracy, while the dashed horizontal threshold marks Delta F = 0 as the keep/prune boundary."
    },
    {
      "caption_length": 389,
      "figure_id": "bmr_pruning_phase_diagram",
      "figure_path": "../../output/figures/bmr_pruning_phase_diagram.png",
      "has_interpretive_boundary": true,
      "has_source_artifact": true,
      "has_visual_encoding_language": true,
      "manuscript": "03_results.md",
      "ok": true,
      "source_artifact_count": 1,
      "source_map_caption_length": 389,
      "visual_encoding": "Zero-centered diverging colorbar encodes Delta F; grid cell text labels KEEP prior or PRUNE prior with the numeric value; the external legend defines the model-comparison meaning of each decision."
    },
    {
      "caption_length": 349,
      "figure_id": "simulation_sensitivity_heatmap",
      "figure_path": "../../output/figures/simulation_sensitivity_heatmap.png",
      "has_interpretive_boundary": true,
      "has_source_artifact": true,
      "has_visual_encoding_language": true,
      "manuscript": "03_results.md",
      "ok": true,
      "source_artifact_count": 1,
      "source_map_caption_length": 349,
      "visual_encoding": "Zero-centered diverging heatmap encodes mean Delta F; contrast-aware cell text reports how many observation-noise rows favor PRUNE, and gridlines preserve row and column separation."
    },
    {
      "caption_length": 346,
      "figure_id": "bmr_robustness_resampling",
      "figure_path": "../../output/figures/bmr_robustness_resampling.png",
      "has_interpretive_boundary": true,
      "has_source_artifact": true,
      "has_visual_encoding_language": true,
      "manuscript": "03_results.md",
      "ok": true,
      "source_artifact_count": 1,
      "source_map_caption_length": 346,
      "visual_encoding": "Two-panel heatmap; sequential colorbar encodes bootstrap pruning rate, binary colorbar encodes Delta-F sign stability, compact cell text provides decision and interval labels, and the external legend distinguishes keep from prune semantics."
    },
    {
      "caption_length": 499,
      "figure_id": "pymdp_profile_comparison",
      "figure_path": "../../output/figures/pymdp_profile_comparison.png",
      "has_interpretive_boundary": true,
      "has_source_artifact": true,
      "has_visual_encoding_language": true,
      "manuscript": "03_results.md",
      "ok": true,
      "source_artifact_count": 3,
      "source_map_caption_length": 499,
      "visual_encoding": "Three panels use profile colors for free energy and posterior mass, an on-figure sign annotation for the lower-free-energy convention, and stacked action bars with an external action legend."
    },
    {
      "caption_length": 343,
      "figure_id": "posterior_trajectory",
      "figure_path": "../../output/figures/posterior_trajectory.png",
      "has_interpretive_boundary": true,
      "has_source_artifact": true,
      "has_visual_encoding_language": true,
      "manuscript": "03_results.md",
      "ok": true,
      "source_artifact_count": 3,
      "source_map_caption_length": 343,
      "visual_encoding": "Line color and marker legend maps profiles; hollow square markers encode perturbation steps; x-axis encodes simulation step and y-axis encodes P(contextual_post_dual state)."
    },
    {
      "caption_length": 506,